{"$id":"https://github.com/rattymcfarty/lift-kb/schemas/exercise.schema.json","$schema":"https://json-schema.org/draft/2020-12/schema","additionalProperties":false,"properties":{"aliases":{"items":{"type":"string"},"type":"array"},"attribution":{"type":"string"},"commonMistakes":{"items":{"type":"string"},"type":"array"},"cues":{"items":{"type":"string"},"type":"array"},"demoMedia":{"additionalProperties":false,"properties":{"images":{"items":{"format":"uri","type":"string"},"type":"array"},"video":{"format":"uri","type":["string","null"]}},"type":"object"},"deprecated":{"default":false,"type":"boolean"},"difficulty":{"enum":["beginner","intermediate","advanced"],"type":"string"},"equipment":{"items":{"type":"string"},"minItems":1,"type":"array"},"id":{"description":"Permanent ID. Never renamed; deprecate via deprecated/replacedBy.","pattern":"^[a-z0-9]+(-[a-z0-9]+)*$","type":"string"},"instructions":{"items":{"minLength":1,"type":"string"},"minItems":2,"type":"array"},"longevityNotes":{"minLength":1,"type":"string"},"movementPattern":{"enum":["squat","hinge","push","pull","carry","lunge","core","cardio","mobility"],"type":"string"},"muscles":{"additionalProperties":false,"properties":{"primary":{"items":{"type":"string"},"minItems":1,"type":"array"},"secondary":{"items":{"type":"string"},"type":"array"}},"required":["primary"],"type":"object"},"name":{"minLength":1,"type":"string"},"progression":{"additionalProperties":false,"properties":{"loadingGuidance":{"type":"string"},"progressTo":{"type":"string"},"regressTo":{"type":"string"}},"type":"object"},"replacedBy":{"type":["string","null"]},"safetyNotes":{"type":"string"},"schemaVersion":{"const":1,"type":"integer"},"sources":{"items":{"additionalProperties":false,"properties":{"publisher":{"type":"string"},"title":{"type":"string"},"url":{"format":"uri","type":"string"}},"required":["title"],"type":"object"},"minItems":1,"type":"array"},"updatedAt":{"pattern":"^\\d{4}-\\d{2}-\\d{2}$","type":"string"}},"required":["id","schemaVersion","name","muscles","equipment","difficulty","movementPattern","instructions","longevityNotes","sources"],"title":"LIFT KB Exercise","type":"object"}